car accident lawyer guys,$596.10,1
car accident lawyer greenville sc,$539.71,2
motorcycle accident lawyers houston,$467.77,3
car accident lawyer san jose,$443.69,4
car accident lawyer reddit,$408.83,5
class action lawsuit for mesothelioma,$396.78,6
car accident lawyer without injury,$383.38,7
best motorcycle accident lawyer los angeles,$379.83,8
car accident lawyer yelp,$362.15,9
car accident lawyer los angeles ca,$358.60,10
car accident lawyers in los angeles ca,$358.60,11
car accident lawyer fresno ca,$334.39,12
car accident lawyer modesto ca,$325.60,13
car accident lawyer memphis tn,$316.88,14
car accident lawyer wilmington nc,$315.64,15
car accident lawyer bay area,$309.97,16
car accident lawyer defense,$307.43,17
semi truck accident lawyers,$304.48,18
car accident lawyer atlanta,$303.03,19
semi truck accident attorneys,$301.54,20
car accident lawyer colorado,$289.43,21
car accident lawyer fort lauderdale,$282.79,22
uber car accident lawyer,$273.78,23
car accident lawyer kissimmee,$272.24,24
car accident lawyer nashville tn,$269.37,25
car accident lawyer san diego ca,$268.29,26
car accident lawyer in victorville,$257.88,27
car accident lawyer questions,$244.55,28
car accident lawyer fresno,$241.63,29
car accident lawyer riverside ca,$239.66,30
car accident lawyer austin tx,$237.66,31
car accident lawyer houston texas,$229.01,32
car accident lawyer houston tx,$229.01,33
car accident lawyer las vegas,$228.39,34
caraccidentlawyer,$224.54,35
car accident lawyer dallas texas,$223.99,36
car accident lawyer dallas tx,$223.99,37
car accident lawyer greensboro nc,$221.21,38
car accident lawyer in san francisco,$219.13,39
car accident lawyer queens,$217.19,40
car accident lawyer near me,$217.14,41
car accident lawyer arlington tx,$217.13,42
car accident lawyer orange county,$214.12,43
car accident lawyer austin,$213.65,44
car accident lawyer asheville nc,$212.88,45
car accident lawyer percentage,$208.99,46
car accident lawyer in laredo tx,$208.25,47
car accident lawyer florida,$208.22,48
car accident lawyer jacksonville fl,$204.05,49
car accident lawyer orange county ca,$202.25,50
truck accident attorney los angeles,$201.17,51
los angeles motorcycle accident lawyer,$200.38,52
motorcycle accident lawyers los angeles,$200.38,53
car accident lawyer sacramento ca,$198.64,54
car accident lawyer las vegas nv,$197.55,55
car accident lawyer utah,$196.81,56
semi truck accident lawyers near me,$194.78,57
car accident lawyer columbus ohio,$194.10,58
car accident lawyer katy,$193.24,59
car accident lawyer bronx,$191.89,60
car accident lawyer free consultation,$190.12,61
car accident lawyer tulsa,$188.47,62
car accident lawyer fort worth,$188.10,63
car accident lawyer in san diego,$188.03,64
car accident lawyer-san diego,$188.03,65
car accident lawyer no injury,$186.29,66
car accident lawyer york pa,$185.47,67
car accident lawyer albuquerque,$184.68,68
car accident lawyer houston,$182.05,69
car accident lawyer in houston,$182.05,70
jewish car accident lawyer,$180.85,71
car accident lawyer san antonio texas,$180.11,72
car accident lawyers los angeles,$177.91,73
car accident lawyer los angeles,$177.91,74
car accident lawyers in los angeles,$177.91,75
car accident lawyer in los angeles,$177.91,76
car accident lawyer los angeles,$177.91,77
best car accident lawyer los angeles,$177.11,78
car accident lawyer pa,$175.96,79
car accident lawyer no insurance,$174.99,80
car accident lawyer vero beach,$174.11,81
car accident lawyer mn,$173.64,82
car accident lawyer property damage,$173.56,83
car accident lawyer winston salem nc,$173.27,84
car accident lawyer georgia,$173.08,85
car accident lawyer lafayette la,$172.63,86
car accident lawyer oakland ca,$171.41,87
car accident lawyer virginia,$170.33,88
car accident lawyer michigan,$169.66,89
car accident lawyer northeast philadelphia,$169.11,90
car accident lawyer virginia beach,$169.08,91
uninsured car accident lawyer,$168.98,92
car accident lawyer ventura ca,$168.63,93
car accident lawyer okc,$166.23,94
car accident lawyer joliet il,$165.67,95
car accident lawyer tampa,$163.87,96
car accident lawyer indianapolis,$163.30,97
houston motorcycle accident lawyer,$163.04,98
car accident attorney los angeles,$160.66,99
car accident lawyer augusta,$156.29,100
car accident lawyer boston,$155.45,101
car accident lawyer denver,$154.99,102
car accident lawyer chicago,$152.82,103
car accident lawyer lexington ky,$150.72,104
auto accident attorney torrance,$150.24,105
car accident lawyer fees,$149.52,106
car accident lawyer st louis mo,$148.71,107
car accident lawyer hartford ct,$148.48,108
car accident lawyer tampa fl,$147.32,109
car accident lawyer cost,$145.90,110
car accident lawyer atlanta ga,$144.88,111
car accident lawyer in atlanta ga,$144.88,112
car accident lawyer miami fl,$144.38,113
car accident lawyer miami,$143.77,114
car accident lawyer san bernardino,$143.08,115
car accident lawyer ct,$140.77,116
auto accident lawyer san francisco,$140.03,117
car accident lawyer seattle,$139.83,118
car accident lawyer st louis,$139.00,119
car accident lawyer kansas city,$134.85,120
car accident lawyer no win no fee,$133.08,121
car accident lawyer moreno valley,$132.99,122
car accident lawyer brooklyn ny,$131.88,123
car accident lawyer ri,$130.49,124
car accident lawyer orlando,$130.49,125
car accident lawyer raleigh nc,$129.93,126
car accident lawyer blog,$128.91,127
car accident lawyer honolulu,$127.08,128
car accident lawyer charlotte nc,$125.37,129
car accident lawyer newark nj,$122.88,130
car accident lawyer in fort lauderdale,$122.45,131
car accident lawyer dc,$121.42,132
car accident lawyer ocala fl,$118.68,133
car accident lawyer philadelphia,$118.43,134
car accident lawyer reno nv,$116.99,135
car accident lawyer yuma az,$116.70,136
car accident lawyer kansas city mo,$114.99,137
car accident lawyer el paso tx,$114.07,138
car accident lawyer montgomery al,$111.65,139
car accident lawyer knoxville tn,$110.83,140
car accident lawyer west palm beach,$110.25,141
car accident lawyer dallas,$109.72,142
car accident lawyer in fayetteville nc,$108.59,143
car accident lawyer wilmington de,$108.05,144
car accident lawyer ny,$107.50,145
car accident lawyer maryland,$107.05,146
car accident lawyer frisco tx,$105.80,147
car accident lawyer nj,$103.92,148
car accident lawyer philadelphia pa,$103.34,149
car accident lawyer dayton ohio,$102.75,150
car accident lawyer queens ny,$102.73,151
car accident lawyer denver colorado,$101.64,152
car accident lawyer killeen texas,$101.36,153
car accident lawyer louisville,$100.66,154
car accident lawyer nyc,$100.44,155
car accident lawyer phoenix,$99.11,156
car accident lawyer cincinnati,$98.00,157
truck accident lawyer los angeles,$93.50,158
car accident lawyer richmond va,$93.00,159
car accident lawyer baltimore md,$92.91,160
car accident lawyer in phoenix,$90.48,161
car accident lawyer pros,$90.46,162
car accident lawyer gastonia nc,$88.74,163
car accident lawyer tucson,$87.44,164
tucson car accident lawyer,$87.28,165
car accident lawyer yakima,$85.49,166
car accident lawyer portland,$84.93,167
car accident lawyer colorado springs,$83.45,168
car accident lawyer omaha,$83.02,169
car accident lawyer baltimore,$82.83,170
car accident lawyer providence ri,$81.38,171
car accident lawyer reno,$80.10,172
car accident lawyer toledo ohio,$78.16,173
car accident lawyer macon ga,$76.28,174
car accident lawyer long island,$75.35,175
car accident lawyer wichita ks,$72.78,176
car accident lawyer gainesville ga,$71.92,177
tucson car accident attorney,$71.07,178
car accident attorney tucson az,$66.35,179
car accident lawyer jersey city nj,$65.46,180
car accident lawyer lancaster pa,$62.38,181
car accident lawyer tyler tx,$61.75,182
